23:45:29.725465 08:00:27:84:b6:43 > 52:54:00:12:35:02, ethertype IPv4 (0x0800), length 291: 10.0.2.15.34106 > 34.120.237.76.443: Flags [P.], seq 2261130165:2261130402, ack 56324184, win 62780, length 237
23:45:29.726647 52:54:00:12:35:02 > 08:00:27:84:b6:43, ethertype IPv4 (0x0800), length 60: 34.120.237.76.443 > 10.0.2.15.34106: Flags [.], ack 237, win 65535, length 0
23:45:29.732791 52:54:00:12:35:02 > 08:00:27:84:b6:43, ethertype IPv4 (0x0800), length 169: 34.120.237.76.443 > 10.0.2.15.34106: Flags [P.], seq 1:116, ack 237, win 65535, length 115
23:45:29.734333 08:00:27:84:b6:43 > 52:54:00:12:35:02, ethertype IPv4 (0x0800), length 93: 10.0.2.15.34106 > 34.120.237.76.443: Flags [P.], seq 237:276, ack 116, win 62780, length 39
23:45:29.734956 52:54:00:12:35:02 > 08:00:27:84:b6:43, ethertype IPv4 (0x0800), length 60: 34.120.237.76.443 > 10.0.2.15.34106: Flags [.], ack 276, win 65535, length 0
23:45:30.729023 08:00:27:84:b6:43 > 52:54:00:12:35:02, ethertype IPv4 (0x0800), length 295: 10.0.2.15.34106 > 34.120.237.76.443: Flags [P.], seq 276:517, ack 116, win 62780, length 241
23:45:30.730209 52:54:00:12:35:02 > 08:00:27:84:b6:43, ethertype IPv4 (0x0800), length 60: 34.120.237.76.443 > 10.0.2.15.34106: Flags [.], ack 517, win 65535, length 0
23:45:30.805095 52:54:00:12:35:02 > 08:00:27:84:b6:43, ethertype IPv4 (0x0800), length 169: 34.120.237.76.443 > 10.0.2.15.34106: Flags [P.], seq 116:231, ack 517, win 65535, length 115
23:45:30.805711 08:00:27:84:b6:43 > 52:54:00:12:35:02, ethertype IPv4 (0x0800), length 93: 10.0.2.15.34106 > 34.120.237.76.443: Flags [P.], seq 517:556, ack 231, win 62780, length 39
23:45:30.807094 52:54:00:12:35:02 > 08:00:27:84:b6:43, ethertype IPv4 (0x0800), length 60: 34.120.237.76.443 > 10.0.2.15.34106: Flags [.], ack 556, win 65535, length 0
23:45:31.236810 08:00:27:84:b6:43 > 52:54:00:12:35:02, ethertype IPv4 (0x0800), length 54: 10.0.2.15.48254 > 152.195.38.76.80: Flags [F.], seq 4066435453, ack 56640002, win 64240, length 0
23:45:31.237741 52:54:00:12:35:02 > 08:00:27:84:b6:43, ethertype IPv4 (0x0800), length 60: 152.195.38.76.80 > 10.0.2.15.48254: Flags [.], ack 1, win 65535, length 0
23:45:31.251404 52:54:00:12:35:02 > 08:00:27:84:b6:43, ethertype IPv4 (0x0800), length 60: 152.195.38.76.80 > 10.0.2.15.48254: Flags [F.], seq 1, ack 1, win 65535, length 0
23:45:31.251435 08:00:27:84:b6:43 > 52:54:00:12:35:02, ethertype IPv4 (0x0800), length 54: 10.0.2.15.48254 > 152.195.38.76.80: Flags [.], ack 2, win 64240, length 0
23:45:31.738328 08:00:27:84:b6:43 > 52:54:00:12:35:02, ethertype IPv4 (0x0800), length 291: 10.0.2.15.34106 > 34.120.237.76.443: Flags [P.], seq 556:793, ack 231, win 62780, length 237
23:45:31.739805 52:54:00:12:35:02 > 08:00:27:84:b6:43, ethertype IPv4 (0x0800), length 60: 34.120.237.76.443 > 10.0.2.15.34106: Flags [.], ack 793, win 65535, length 0
23:45:31.746900 52:54:00:12:35:02 > 08:00:27:84:b6:43, ethertype IPv4 (0x0800), length 169: 34.120.237.76.443 > 10.0.2.15.34106: Flags [P.], seq 231:346, ack 793, win 65535, length 115
23:45:31.747645 08:00:27:84:b6:43 > 52:54:00:12:35:02, ethertype IPv4 (0x0800), length 93: 10.0.2.15.34106 > 34.120.237.76.443: Flags [P.], seq 793:832, ack 346, win 62780, length 39
23:45:31.748958 52:54:00:12:35:02 > 08:00:27:84:b6:43, ethertype IPv4 (0x0800), length 60: 34.120.237.76.443 > 10.0.2.15.34106: Flags [.], ack 832, win 65535, length 0
23:45:32.762041 08:00:27:84:b6:43 > 52:54:00:12:35:02, ethertype IPv4 (0x0800), length 291: 10.0.2.15.34106 > 34.120.237.76.443: Flags [P.], seq 832:1069, ack 346, win 62780, length 237
23:45:32.763863 52:54:00:12:35:02 > 08:00:27:84:b6:43, ethertype IPv4 (0x0800), length 60: 34.120.237.76.443 > 10.0.2.15.34106: Flags [.], ack 1069, win 65535, length 0
23:45:32.770162 52:54:00:12:35:02 > 08:00:27:84:b6:43, ethertype IPv4 (0x0800), length 168: 34.120.237.76.443 > 10.0.2.15.34106: Flags [P.], seq 346:460, ack 1069, win 65535, length 114
23:45:32.770790 08:00:27:84:b6:43 > 52:54:00:12:35:02, ethertype IPv4 (0x0800), length 93: 10.0.2.15.34106 > 34.120.237.76.443: Flags [P.], seq 1069:1108, ack 460, win 62780, length 39
23:45:32.771201 52:54:00:12:35:02 > 08:00:27:84:b6:43, ethertype IPv4 (0x0800), length 60: 34.120.237.76.443 > 10.0.2.15.34106: Flags [.], ack 1108, win 65535, length 0
23:45:33.365722 08:00:27:84:b6:43 > 52:54:00:12:35:02, ethertype IPv4 (0x0800), length 54: 10.0.2.15.38614 > 34.107.221.82.80: Flags [.], ack 55360218, win 64024, length 0
23:45:33.365757 08:00:27:84:b6:43 > 52:54:00:12:35:02, ethertype IPv4 (0x0800), length 54: 10.0.2.15.38612 > 34.107.221.82.80: Flags [.], ack 55232300, win 63942, length 0
23:45:33.366467 52:54:00:12:35:02 > 08:00:27:84:b6:43, ethertype IPv4 (0x0800), length 60: 34.107.221.82.80 > 10.0.2.15.38614: Flags [.], ack 1, win 65535, length 0
23:45:33.366468 52:54:00:12:35:02 > 08:00:27:84:b6:43, ethertype IPv4 (0x0800), length 60: 34.107.221.82.80 > 10.0.2.15.38612: Flags [.], ack 1, win 65535, length 0
23:45:33.740306 08:00:27:84:b6:43 > 52:54:00:12:35:02, ethertype IPv4 (0x0800), length 258: 10.0.2.15.34106 > 34.120.237.76.443: Flags [P.], seq 1108:1312, ack 460, win 62780, length 204
23:45:33.741101 52:54:00:12:35:02 > 08:00:27:84:b6:43, ethertype IPv4 (0x0800), length 60: 34.120.237.76.443 > 10.0.2.15.34106: Flags [.], ack 1312, win 65535, length 0
23:45:33.746031 52:54:00:12:35:02 > 08:00:27:84:b6:43, ethertype IPv4 (0x0800), length 2185: 34.120.237.76.443 > 10.0.2.15.34106: Flags [P.], seq 460:2591, ack 1312, win 65535, length 2131
23:45:33.746050 08:00:27:84:b6:43 > 52:54:00:12:35:02, ethertype IPv4 (0x0800), length 54: 10.0.2.15.34106 > 34.120.237.76.443: Flags [.], ack 2591, win 62780, length 0
23:45:33.747302 52:54:00:12:35:02 > 08:00:27:84:b6:43, ethertype IPv4 (0x0800), length 4290: 34.120.237.76.443 > 10.0.2.15.34106: Flags [P.], seq 2591:6827, ack 1312, win 65535, length 4236
23:45:33.747326 08:00:27:84:b6:43 > 52:54:00:12:35:02, ethertype IPv4 (0x0800), length 54: 10.0.2.15.34106 > 34.120.237.76.443: Flags [.], ack 6827, win 62780, length 0
23:45:33.748057 52:54:00:12:35:02 > 08:00:27:84:b6:43, ethertype IPv4 (0x0800), length 1514: 34.120.237.76.443 > 10.0.2.15.34106: Flags [.], seq 6827:8287, ack 1312, win 65535, length 1460
23:45:33.748110 52:54:00:12:35:02 > 08:00:27:84:b6:43, ethertype IPv4 (0x0800), length 3686: 34.120.237.76.443 > 10.0.2.15.34106: Flags [P.], seq 8287:11919, ack 1312, win 65535, length 3632
23:45:33.748117 08:00:27:84:b6:43 > 52:54:00:12:35:02, ethertype IPv4 (0x0800), length 54: 10.0.2.15.34106 > 34.120.237.76.443: Flags [.], ack 11919, win 62780, length 0
23:45:33.748359 08:00:27:84:b6:43 > 52:54:00:12:35:02, ethertype IPv4 (0x0800), length 93: 10.0.2.15.34106 > 34.120.237.76.443: Flags [P.], seq 1312:1351, ack 11919, win 62780, length 39
23:45:33.749109 52:54:00:12:35:02 > 08:00:27:84:b6:43, ethertype IPv4 (0x0800), length 60: 34.120.237.76.443 > 10.0.2.15.34106: Flags [.], ack 1351, win 65535, length 0
23:45:34.581237 08:00:27:84:b6:43 > 52:54:00:12:35:02, ethertype IPv4 (0x0800), length 54: 10.0.2.15.38778 > 104.71.61.81.80: Flags [.], ack 55618672, win 61570, length 0
23:45:34.582441 52:54:00:12:35:02 > 08:00:27:84:b6:43, ethertype IPv4 (0x0800), length 60: 104.71.61.81.80 > 10.0.2.15.38778: Flags [.], ack 1, win 65535, length 0
23:45:34.905022 08:00:27:84:b6:43 > 52:54:00:12:35:02, ethertype IPv4 (0x0800), length 54: 10.0.2.15.48256 > 152.195.38.76.80: Flags [.], ack 56064739, win 63503, length 0
23:45:34.905903 52:54:00:12:35:02 > 08:00:27:84:b6:43, ethertype IPv4 (0x0800), length 60: 152.195.38.76.80 > 10.0.2.15.48256: Flags [.], ack 1, win 65535, length 0
23:45:35.413318 08:00:27:84:b6:43 > 52:54:00:12:35:02, ethertype IPv4 (0x0800), length 54: 10.0.2.15.46866 > 104.71.61.74.80: Flags [.], ack 56576892, win 63350, length 0
23:45:35.413353 08:00:27:84:b6:43 > 52:54:00:12:35:02, ethertype IPv4 (0x0800), length 54: 10.0.2.15.46852 > 104.71.61.74.80: Flags [.], ack 56193782, win 62460, length 0
23:45:35.413361 08:00:27:84:b6:43 > 52:54:00:12:35:02, ethertype IPv4 (0x0800), length 54: 10.0.2.15.46868 > 104.71.61.74.80: Flags [.], ack 56512892, win 63350, length 0
23:45:35.414282 52:54:00:12:35:02 > 08:00:27:84:b6:43, ethertype IPv4 (0x0800), length 60: 104.71.61.74.80 > 10.0.2.15.46866: Flags [.], ack 1, win 65535, length 0
23:45:35.414283 52:54:00:12:35:02 > 08:00:27:84:b6:43, ethertype IPv4 (0x0800), length 60: 104.71.61.74.80 > 10.0.2.15.46852: Flags [.], ack 1, win 65535, length 0
23:45:35.414283 52:54:00:12:35:02 > 08:00:27:84:b6:43, ethertype IPv4 (0x0800), length 60: 104.71.61.74.80 > 10.0.2.15.46868: Flags [.], ack 1, win 65535, length 0
23:45:37.045981 08:00:27:84:b6:43 > 52:54:00:12:35:02, ethertype IPv4 (0x0800), length 203: 10.0.2.15.55890 > 34.120.208.123.443: Flags [P.], seq 3445805798:3445805947, ack 55877730, win 62780, length 149
23:45:37.046033 08:00:27:84:b6:43 > 52:54:00:12:35:02, ethertype IPv4 (0x0800), length 1017: 10.0.2.15.55890 > 34.120.208.123.443: Flags [P.], seq 149:1112, ack 1, win 62780, length 963
23:45:37.046958 52:54:00:12:35:02 > 08:00:27:84:b6:43, ethertype IPv4 (0x0800), length 60: 34.120.208.123.443 > 10.0.2.15.55890: Flags [.], ack 149, win 65535, length 0
23:45:37.047505 52:54:00:12:35:02 > 08:00:27:84:b6:43, ethertype IPv4 (0x0800), length 60: 34.120.208.123.443 > 10.0.2.15.55890: Flags [.], ack 1112, win 65535, length 0
23:45:37.231197 08:00:27:84:b6:43 > 52:54:00:12:35:02, ethertype IPv4 (0x0800), length 308: 10.0.2.15.34106 > 34.120.237.76.443: Flags [P.], seq 1351:1605, ack 11919, win 62780, length 254
23:45:37.232125 08:00:27:84:b6:43 > 52:54:00:12:35:02, ethertype IPv4 (0x0800), length 259: 10.0.2.15.34106 > 34.120.237.76.443: Flags [P.], seq 1605:1810, ack 11919, win 62780, length 205
23:45:37.232853 52:54:00:12:35:02 > 08:00:27:84:b6:43, ethertype IPv4 (0x0800), length 60: 34.120.237.76.443 > 10.0.2.15.34106: Flags [.], ack 1605, win 65535, length 0
23:45:37.233595 52:54:00:12:35:02 > 08:00:27:84:b6:43, ethertype IPv4 (0x0800), length 60: 34.120.237.76.443 > 10.0.2.15.34106: Flags [.], ack 1810, win 65535, length 0
23:45:37.235079 08:00:27:84:b6:43 > 52:54:00:12:35:02, ethertype IPv4 (0x0800), length 259: 10.0.2.15.34106 > 34.120.237.76.443: Flags [P.], seq 1810:2015, ack 11919, win 62780, length 205
23:45:37.235821 52:54:00:12:35:02 > 08:00:27:84:b6:43, ethertype IPv4 (0x0800), length 60: 34.120.237.76.443 > 10.0.2.15.34106: Flags [.], ack 2015, win 65535, length 0
23:45:37.261775 52:54:00:12:35:02 > 08:00:27:84:b6:43, ethertype IPv4 (0x0800), length 247: 34.120.237.76.443 > 10.0.2.15.34106: Flags [P.], seq 11919:12112, ack 2015, win 65535, length 193
23:45:37.262120 08:00:27:84:b6:43 > 52:54:00:12:35:02, ethertype IPv4 (0x0800), length 93: 10.0.2.15.34106 > 34.120.237.76.443: Flags [P.], seq 2015:2054, ack 12112, win 62780, length 39
23:45:37.263325 52:54:00:12:35:02 > 08:00:27:84:b6:43, ethertype IPv4 (0x0800), length 60: 34.120.237.76.443 > 10.0.2.15.34106: Flags [.], ack 2054, win 65535, length 0
23:45:37.350057 52:54:00:12:35:02 > 08:00:27:84:b6:43, ethertype IPv4 (0x0800), length 345: 34.120.208.123.443 > 10.0.2.15.55890: Flags [P.], seq 1:292, ack 1112, win 65535, length 291
23:45:37.350622 08:00:27:84:b6:43 > 52:54:00:12:35:02, ethertype IPv4 (0x0800), length 93: 10.0.2.15.55890 > 34.120.208.123.443: Flags [P.], seq 1112:1151, ack 292, win 62780, length 39
23:45:37.350925 52:54:00:12:35:02 > 08:00:27:84:b6:43, ethertype IPv4 (0x0800), length 60: 34.120.208.123.443 > 10.0.2.15.55890: Flags [.], ack 1151, win 65535, length 0
23:45:38.175999 08:00:27:84:b6:43 > 52:54:00:12:35:02, ethertype IPv4 (0x0800), length 201: 10.0.2.15.55890 > 34.120.208.123.443: Flags [P.], seq 1151:1298, ack 292, win 62780, length 147
23:45:38.176024 08:00:27:84:b6:43 > 52:54:00:12:35:02, ethertype IPv4 (0x0800), length 1397: 10.0.2.15.55890 > 34.120.208.123.443: Flags [P.], seq 1298:2641, ack 292, win 62780, length 1343
23:45:38.177437 52:54:00:12:35:02 > 08:00:27:84:b6:43, ethertype IPv4 (0x0800), length 60: 34.120.208.123.443 > 10.0.2.15.55890: Flags [.], ack 1298, win 65535, length 0
23:45:38.177458 52:54:00:12:35:02 > 08:00:27:84:b6:43, ethertype IPv4 (0x0800), length 60: 34.120.208.123.443 > 10.0.2.15.55890: Flags [.], ack 2641, win 65535, length 0
23:45:38.483414 52:54:00:12:35:02 > 08:00:27:84:b6:43, ethertype IPv4 (0x0800), length 377: 34.120.208.123.443 > 10.0.2.15.55890: Flags [P.], seq 292:615, ack 2641, win 65535, length 323
23:45:38.483822 08:00:27:84:b6:43 > 52:54:00:12:35:02, ethertype IPv4 (0x0800), length 93: 10.0.2.15.55890 > 34.120.208.123.443: Flags [P.], seq 2641:2680, ack 615, win 62780, length 39
23:45:38.484495 52:54:00:12:35:02 > 08:00:27:84:b6:43, ethertype IPv4 (0x0800), length 60: 34.120.208.123.443 > 10.0.2.15.55890: Flags [.], ack 2680, win 65535, length 0
23:45:39.561104 08:00:27:84:b6:43 > 52:54:00:12:35:02, ethertype IPv4 (0x0800), length 202: 10.0.2.15.55890 > 34.120.208.123.443: Flags [P.], seq 2680:2828, ack 615, win 62780, length 148
23:45:39.561147 08:00:27:84:b6:43 > 52:54:00:12:35:02, ethertype IPv4 (0x0800), length 1014: 10.0.2.15.55890 > 34.120.208.123.443: Flags [P.], seq 2828:3788, ack 615, win 62780, length 960
23:45:39.562330 52:54:00:12:35:02 > 08:00:27:84:b6:43, ethertype IPv4 (0x0800), length 60: 34.120.208.123.443 > 10.0.2.15.55890: Flags [.], ack 2828, win 65535, length 0
23:45:39.562331 52:54:00:12:35:02 > 08:00:27:84:b6:43, ethertype IPv4 (0x0800), length 60: 34.120.208.123.443 > 10.0.2.15.55890: Flags [.], ack 3788, win 65535, length 0
23:45:39.563034 08:00:27:84:b6:43 > 52:54:00:12:35:02, ethertype IPv4 (0x0800), length 258: 10.0.2.15.34106 > 34.120.237.76.443: Flags [P.], seq 2054:2258, ack 12112, win 62780, length 204
23:45:39.563259 08:00:27:84:b6:43 > 52:54:00:12:35:02, ethertype IPv4 (0x0800), length 466: 10.0.2.15.34106 > 34.120.237.76.443: Flags [P.], seq 2258:2670, ack 12112, win 62780, length 412
23:45:39.563380 08:00:27:84:b6:43 > 52:54:00:12:35:02, ethertype IPv4 (0x0800), length 258: 10.0.2.15.34106 > 34.120.237.76.443: Flags [P.], seq 2670:2874, ack 12112, win 62780, length 204
23:45:39.563536 52:54:00:12:35:02 > 08:00:27:84:b6:43, ethertype IPv4 (0x0800), length 60: 34.120.237.76.443 > 10.0.2.15.34106: Flags [.], ack 2258, win 65535, length 0
23:45:39.563600 52:54:00:12:35:02 > 08:00:27:84:b6:43, ethertype IPv4 (0x0800), length 60: 34.120.237.76.443 > 10.0.2.15.34106: Flags [.], ack 2670, win 65535, length 0
23:45:39.563600 52:54:00:12:35:02 > 08:00:27:84:b6:43, ethertype IPv4 (0x0800), length 60: 34.120.237.76.443 > 10.0.2.15.34106: Flags [.], ack 2874, win 65535, length 0
23:45:39.565300 08:00:27:84:b6:43 > 52:54:00:12:35:02, ethertype IPv4 (0x0800), length 259: 10.0.2.15.34106 > 34.120.237.76.443: Flags [P.], seq 2874:3079, ack 12112, win 62780, length 205
23:45:39.565932 08:00:27:84:b6:43 > 52:54:00:12:35:02, ethertype IPv4 (0x0800), length 292: 10.0.2.15.34106 > 34.120.237.76.443: Flags [P.], seq 3079:3317, ack 12112, win 62780, length 238
23:45:39.565945 52:54:00:12:35:02 > 08:00:27:84:b6:43, ethertype IPv4 (0x0800), length 60: 34.120.237.76.443 > 10.0.2.15.34106: Flags [.], ack 3079, win 65535, length 0
23:45:39.567080 52:54:00:12:35:02 > 08:00:27:84:b6:43, ethertype IPv4 (0x0800), length 60: 34.120.237.76.443 > 10.0.2.15.34106: Flags [.], ack 3317, win 65535, length 0
23:45:39.571258 52:54:00:12:35:02 > 08:00:27:84:b6:43, ethertype IPv4 (0x0800), length 137: 34.120.237.76.443 > 10.0.2.15.34106: Flags [P.], seq 12112:12195, ack 3317, win 65535, length 83
23:45:39.574659 52:54:00:12:35:02 > 08:00:27:84:b6:43, ethertype IPv4 (0x0800), length 308: 34.120.237.76.443 > 10.0.2.15.34106: Flags [P.], seq 12195:12449, ack 3317, win 65535, length 254
23:45:39.575150 08:00:27:84:b6:43 > 52:54:00:12:35:02, ethertype IPv4 (0x0800), length 93: 10.0.2.15.34106 > 34.120.237.76.443: Flags [P.], seq 3317:3356, ack 12449, win 62780, length 39
23:45:39.576279 52:54:00:12:35:02 > 08:00:27:84:b6:43, ethertype IPv4 (0x0800), length 60: 34.120.237.76.443 > 10.0.2.15.34106: Flags [.], ack 3356, win 65535, length 0
23:45:39.580693 52:54:00:12:35:02 > 08:00:27:84:b6:43, ethertype IPv4 (0x0800), length 115: 34.120.237.76.443 > 10.0.2.15.34106: Flags [P.], seq 12449:12510, ack 3356, win 65535, length 61
23:45:39.621605 08:00:27:84:b6:43 > 52:54:00:12:35:02, ethertype IPv4 (0x0800), length 54: 10.0.2.15.34106 > 34.120.237.76.443: Flags [.], ack 12510, win 62780, length 0
23:45:39.829450 52:54:00:12:35:02 > 08:00:27:84:b6:43, ethertype IPv4 (0x0800), length 229: 34.120.208.123.443 > 10.0.2.15.55890: Flags [P.], seq 615:790, ack 3788, win 65535, length 175
23:45:39.829831 08:00:27:84:b6:43 > 52:54:00:12:35:02, ethertype IPv4 (0x0800), length 93: 10.0.2.15.55890 > 34.120.208.123.443: Flags [P.], seq 3788:3827, ack 790, win 62780, length 39
23:45:39.830268 52:54:00:12:35:02 > 08:00:27:84:b6:43, ethertype IPv4 (0x0800), length 60: 34.120.208.123.443 > 10.0.2.15.55890: Flags [.], ack 3827, win 65535, length 0
23:45:40.484571 08:00:27:84:b6:43 > 52:54:00:12:35:02, ethertype IPv4 (0x0800), length 74: 10.0.2.15.46806 > 142.250.77.238.443: Flags [S], seq 393978307, win 64240, options [mss 1460,sackOK,TS val 3394222146 ecr 0,nop,wscale 7], length 0
23:45:40.511960 52:54:00:12:35:02 > 08:00:27:84:b6:43, ethertype IPv4 (0x0800), length 60: 142.250.77.238.443 > 10.0.2.15.46806: Flags [S.], seq 58304001, ack 393978308, win 65535, options [mss 1460], length 0
23:45:40.512010 08:00:27:84:b6:43 > 52:54:00:12:35:02, ethertype IPv4 (0x0800), length 54: 10.0.2.15.46806 > 142.250.77.238.443: Flags [.], ack 1, win 64240, length 0
23:45:40.513035 08:00:27:84:b6:43 > 52:54:00:12:35:02, ethertype IPv4 (0x0800), length 717: 10.0.2.15.46806 > 142.250.77.238.443: Flags [P.], seq 1:664, ack 1, win 64240, length 663
23:45:40.513512 52:54:00:12:35:02 > 08:00:27:84:b6:43, ethertype IPv4 (0x0800), length 60: 142.250.77.238.443 > 10.0.2.15.46806: Flags [.], ack 664, win 65535, length 0
23:45:40.609196 52:54:00:12:35:02 > 08:00:27:84:b6:43, ethertype IPv4 (0x0800), length 2974: 142.250.77.238.443 > 10.0.2.15.46806: Flags [.], seq 1:2921, ack 664, win 65535, length 2920
23:45:40.609232 08:00:27:84:b6:43 > 52:54:00:12:35:02, ethertype IPv4 (0x0800), length 54: 10.0.2.15.46806 > 142.250.77.238.443: Flags [.], ack 2921, win 62780, length 0
23:45:40.609708 52:54:00:12:35:02 > 08:00:27:84:b6:43, ethertype IPv4 (0x0800), length 3716: 142.250.77.238.443 > 10.0.2.15.46806: Flags [P.], seq 2921:6583, ack 664, win 65535, length 3662
23:45:40.609722 08:00:27:84:b6:43 > 52:54:00:12:35:02, ethertype IPv4 (0x0800), length 54: 10.0.2.15.46806 > 142.250.77.238.443: Flags [.], ack 6583, win 62780, length 0
23:45:40.628619 08:00:27:84:b6:43 > 52:54:00:12:35:02, ethertype IPv4 (0x0800), length 74: 10.0.2.15.51158 > 142.250.194.195.80: Flags [S], seq 4222344847, win 64240, options [mss 1460,sackOK,TS val 2511213481 ecr 0,nop,wscale 7], length 0
23:45:40.639790 52:54:00:12:35:02 > 08:00:27:84:b6:43, ethertype IPv4 (0x0800), length 60: 142.250.194.195.80 > 10.0.2.15.51158: Flags [S.], seq 58368001, ack 4222344848, win 65535, options [mss 1460], length 0
23:45:40.639851 08:00:27:84:b6:43 > 52:54:00:12:35:02, ethertype IPv4 (0x0800), length 54: 10.0.2.15.51158 > 142.250.194.195.80: Flags [.], ack 1, win 64240, length 0
23:45:40.640164 08:00:27:84:b6:43 > 52:54:00:12:35:02, ethertype IPv4 (0x0800), length 474: 10.0.2.15.51158 > 142.250.194.195.80: Flags [P.], seq 1:421, ack 1, win 64240, length 420: HTTP: POST /wr2 HTTP/1.1
23:45:40.640568 52:54:00:12:35:02 > 08:00:27:84:b6:43, ethertype IPv4 (0x0800), length 60: 142.250.194.195.80 > 10.0.2.15.51158: Flags [.], ack 421, win 65535, length 0
23:45:40.700831 08:00:27:84:b6:43 > 52:54:00:12:35:02, ethertype IPv4 (0x0800), length 74: 10.0.2.15.46808 > 142.250.77.238.443: Flags [S], seq 2718912613, win 64240, options [mss 1460,sackOK,TS val 3394222362 ecr 0,nop,wscale 7], length 0
23:45:40.704444 08:00:27:84:b6:43 > 52:54:00:12:35:02, ethertype IPv4 (0x0800), length 74: 10.0.2.15.46824 > 142.250.77.238.443: Flags [S], seq 3242372362, win 64240, options [mss 1460,sackOK,TS val 3394222365 ecr 0,nop,wscale 7], length 0
23:45:40.708841 52:54:00:12:35:02 > 08:00:27:84:b6:43, ethertype IPv4 (0x0800), length 60: 142.250.77.238.443 > 10.0.2.15.46808: Flags [S.], seq 58496001, ack 2718912614, win 65535, options [mss 1460], length 0
23:45:40.708875 08:00:27:84:b6:43 > 52:54:00:12:35:02, ethertype IPv4 (0x0800), length 54: 10.0.2.15.46808 > 142.250.77.238.443: Flags [.], ack 1, win 64240, length 0
23:45:40.710183 08:00:27:84:b6:43 > 52:54:00:12:35:02, ethertype IPv4 (0x0800), length 717: 10.0.2.15.46808 > 142.250.77.238.443: Flags [P.], seq 1:664, ack 1, win 64240, length 663
23:45:40.710857 52:54:00:12:35:02 > 08:00:27:84:b6:43, ethertype IPv4 (0x0800), length 60: 142.250.77.238.443 > 10.0.2.15.46808: Flags [.], ack 664, win 65535, length 0
23:45:40.733530 52:54:00:12:35:02 > 08:00:27:84:b6:43, ethertype IPv4 (0x0800), length 60: 142.250.77.238.443 > 10.0.2.15.46824: Flags [S.], seq 58560001, ack 3242372363, win 65535, options [mss 1460], length 0
23:45:40.733531 52:54:00:12:35:02 > 08:00:27:84:b6:43, ethertype IPv4 (0x0800), length 755: 142.250.194.195.80 > 10.0.2.15.51158: Flags [P.], seq 1:702, ack 421, win 65535, length 701: HTTP: HTTP/1.1 200 OK
23:45:40.733580 08:00:27:84:b6:43 > 52:54:00:12:35:02, ethertype IPv4 (0x0800), length 54: 10.0.2.15.46824 > 142.250.77.238.443: Flags [.], ack 1, win 64240, length 0
23:45:40.733600 08:00:27:84:b6:43 > 52:54:00:12:35:02, ethertype IPv4 (0x0800), length 54: 10.0.2.15.51158 > 142.250.194.195.80: Flags [.], ack 702, win 63539, length 0
23:45:40.735270 08:00:27:84:b6:43 > 52:54:00:12:35:02, ethertype IPv4 (0x0800), length 717: 10.0.2.15.46824 > 142.250.77.238.443: Flags [P.], seq 1:664, ack 1, win 64240, length 663
23:45:40.735848 52:54:00:12:35:02 > 08:00:27:84:b6:43, ethertype IPv4 (0x0800), length 60: 142.250.77.238.443 > 10.0.2.15.46824: Flags [.], ack 664, win 65535, length 0
23:45:40.738145 08:00:27:84:b6:43 > 52:54:00:12:35:02, ethertype IPv4 (0x0800), length 118: 10.0.2.15.46806 > 142.250.77.238.443: Flags [P.], seq 664:728, ack 6583, win 62780, length 64
23:45:40.738755 08:00:27:84:b6:43 > 52:54:00:12:35:02, ethertype IPv4 (0x0800), length 224: 10.0.2.15.46806 > 142.250.77.238.443: Flags [P.], seq 728:898, ack 6583, win 62780, length 170
23:45:40.739373 52:54:00:12:35:02 > 08:00:27:84:b6:43, ethertype IPv4 (0x0800), length 60: 142.250.77.238.443 > 10.0.2.15.46806: Flags [.], ack 728, win 65535, length 0
23:45:40.739374 52:54:00:12:35:02 > 08:00:27:84:b6:43, ethertype IPv4 (0x0800), length 60: 142.250.77.238.443 > 10.0.2.15.46806: Flags [.], ack 898, win 65535, length 0
23:45:40.751531 52:54:00:12:35:02 > 08:00:27:84:b6:43, ethertype IPv4 (0x0800), length 699: 142.250.77.238.443 > 10.0.2.15.46806: Flags [P.], seq 6583:7228, ack 898, win 65535, length 645
23:45:40.751564 08:00:27:84:b6:43 > 52:54:00:12:35:02, ethertype IPv4 (0x0800), length 54: 10.0.2.15.46806 > 142.250.77.238.443: Flags [.], ack 7228, win 62780, length 0
23:45:40.752746 08:00:27:84:b6:43 > 52:54:00:12:35:02, ethertype IPv4 (0x0800), length 85: 10.0.2.15.46806 > 142.250.77.238.443: Flags [P.], seq 898:929, ack 7228, win 62780, length 31
23:45:40.753420 52:54:00:12:35:02 > 08:00:27:84:b6:43, ethertype IPv4 (0x0800), length 60: 142.250.77.238.443 > 10.0.2.15.46806: Flags [.], ack 929, win 65535, length 0
23:45:40.792030 08:00:27:84:b6:43 > 52:54:00:12:35:02, ethertype IPv4 (0x0800), length 307: 10.0.2.15.34106 > 34.120.237.76.443: Flags [P.], seq 3356:3609, ack 12510, win 62780, length 253
23:45:40.792876 52:54:00:12:35:02 > 08:00:27:84:b6:43, ethertype IPv4 (0x0800), length 60: 34.120.237.76.443 > 10.0.2.15.34106: Flags [.], ack 3609, win 65535, length 0
23:45:40.793749 08:00:27:84:b6:43 > 52:54:00:12:35:02, ethertype IPv4 (0x0800), length 259: 10.0.2.15.34106 > 34.120.237.76.443: Flags [P.], seq 3609:3814, ack 12510, win 62780, length 205
23:45:40.794719 52:54:00:12:35:02 > 08:00:27:84:b6:43, ethertype IPv4 (0x0800), length 60: 34.120.237.76.443 > 10.0.2.15.34106: Flags [.], ack 3814, win 65535, length 0
23:45:40.795177 08:00:27:84:b6:43 > 52:54:00:12:35:02, ethertype IPv4 (0x0800), length 259: 10.0.2.15.34106 > 34.120.237.76.443: Flags [P.], seq 3814:4019, ack 12510, win 62780, length 205
23:45:40.795429 52:54:00:12:35:02 > 08:00:27:84:b6:43, ethertype IPv4 (0x0800), length 60: 34.120.237.76.443 > 10.0.2.15.34106: Flags [.], ack 4019, win 65535, length 0
23:45:40.803763 52:54:00:12:35:02 > 08:00:27:84:b6:43, ethertype IPv4 (0x0800), length 2974: 34.120.237.76.443 > 10.0.2.15.34106: Flags [.], seq 12510:15430, ack 4019, win 65535, length 2920
23:45:40.803787 08:00:27:84:b6:43 > 52:54:00:12:35:02, ethertype IPv4 (0x0800), length 54: 10.0.2.15.34106 > 34.120.237.76.443: Flags [.], ack 15430, win 62780, length 0
23:45:40.803868 52:54:00:12:35:02 > 08:00:27:84:b6:43, ethertype IPv4 (0x0800), length 8020: 34.120.237.76.443 > 10.0.2.15.34106: Flags [P.], seq 15430:23396, ack 4019, win 65535, length 7966
23:45:40.803874 08:00:27:84:b6:43 > 52:54:00:12:35:02, ethertype IPv4 (0x0800), length 54: 10.0.2.15.34106 > 34.120.237.76.443: Flags [.], ack 23396, win 62780, length 0
23:45:40.804310 08:00:27:84:b6:43 > 52:54:00:12:35:02, ethertype IPv4 (0x0800), length 93: 10.0.2.15.34106 > 34.120.237.76.443: Flags [P.], seq 4019:4058, ack 23396, win 62780, length 39
23:45:40.804944 52:54:00:12:35:02 > 08:00:27:84:b6:43, ethertype IPv4 (0x0800), length 60: 34.120.237.76.443 > 10.0.2.15.34106: Flags [.], ack 4058, win 65535, length 0
23:45:40.864982 52:54:00:12:35:02 > 08:00:27:84:b6:43, ethertype IPv4 (0x0800), length 2974: 142.250.77.238.443 > 10.0.2.15.46824: Flags [.], seq 1:2921, ack 664, win 65535, length 2920
23:45:40.864984 52:54:00:12:35:02 > 08:00:27:84:b6:43, ethertype IPv4 (0x0800), length 2974: 142.250.77.238.443 > 10.0.2.15.46808: Flags [.], seq 1:2921, ack 664, win 65535, length 2920
23:45:40.865016 08:00:27:84:b6:43 > 52:54:00:12:35:02, ethertype IPv4 (0x0800), length 54: 10.0.2.15.46824 > 142.250.77.238.443: Flags [.], ack 2921, win 62780, length 0
23:45:40.865033 08:00:27:84:b6:43 > 52:54:00:12:35:02, ethertype IPv4 (0x0800), length 54: 10.0.2.15.46808 > 142.250.77.238.443: Flags [.], ack 2921, win 62780, length 0
23:45:40.865700 52:54:00:12:35:02 > 08:00:27:84:b6:43, ethertype IPv4 (0x0800), length 2782: 142.250.77.238.443 > 10.0.2.15.46824: Flags [P.], seq 2921:5649, ack 664, win 65535, length 2728
23:45:40.865701 52:54:00:12:35:02 > 08:00:27:84:b6:43, ethertype IPv4 (0x0800), length 3716: 142.250.77.238.443 > 10.0.2.15.46808: Flags [P.], seq 2921:6583, ack 664, win 65535, length 3662
23:45:40.865715 08:00:27:84:b6:43 > 52:54:00:12:35:02, ethertype IPv4 (0x0800), length 54: 10.0.2.15.46824 > 142.250.77.238.443: Flags [.], ack 5649, win 62780, length 0
23:45:40.865727 08:00:27:84:b6:43 > 52:54:00:12:35:02, ethertype IPv4 (0x0800), length 54: 10.0.2.15.46808 > 142.250.77.238.443: Flags [.], ack 6583, win 62780, length 0
23:45:40.866344 52:54:00:12:35:02 > 08:00:27:84:b6:43, ethertype IPv4 (0x0800), length 989: 142.250.77.238.443 > 10.0.2.15.46824: Flags [P.], seq 5649:6584, ack 664, win 65535, length 935
23:45:40.866356 08:00:27:84:b6:43 > 52:54:00:12:35:02, ethertype IPv4 (0x0800), length 54: 10.0.2.15.46824 > 142.250.77.238.443: Flags [.], ack 6584, win 62780, length 0
23:45:40.872884 08:00:27:84:b6:43 > 52:54:00:12:35:02, ethertype IPv4 (0x0800), length 118: 10.0.2.15.46824 > 142.250.77.238.443: Flags [P.], seq 664:728, ack 6584, win 62780, length 64
23:45:40.873154 08:00:27:84:b6:43 > 52:54:00:12:35:02, ethertype IPv4 (0x0800), length 118: 10.0.2.15.46808 > 142.250.77.238.443: Flags [P.], seq 664:728, ack 6583, win 62780, length 64
23:45:40.873410 08:00:27:84:b6:43 > 52:54:00:12:35:02, ethertype IPv4 (0x0800), length 241: 10.0.2.15.46824 > 142.250.77.238.443: Flags [P.], seq 728:915, ack 6584, win 62780, length 187
23:45:40.873718 08:00:27:84:b6:43 > 52:54:00:12:35:02, ethertype IPv4 (0x0800), length 492: 10.0.2.15.46806 > 142.250.77.238.443: Flags [P.], seq 929:1367, ack 7228, win 62780, length 438
23:45:40.873763 08:00:27:84:b6:43 > 52:54:00:12:35:02, ethertype IPv4 (0x0800), length 241: 10.0.2.15.46808 > 142.250.77.238.443: Flags [P.], seq 728:915, ack 6583, win 62780, length 187
23:45:40.874186 52:54:00:12:35:02 > 08:00:27:84:b6:43, ethertype IPv4 (0x0800), length 60: 142.250.77.238.443 > 10.0.2.15.46824: Flags [.], ack 728, win 65535, length 0
23:45:40.874187 52:54:00:12:35:02 > 08:00:27:84:b6:43, ethertype IPv4 (0x0800), length 60: 142.250.77.238.443 > 10.0.2.15.46808: Flags [.], ack 728, win 65535, length 0
23:45:40.874188 52:54:00:12:35:02 > 08:00:27:84:b6:43, ethertype IPv4 (0x0800), length 60: 142.250.77.238.443 > 10.0.2.15.46824: Flags [.], ack 915, win 65535, length 0
23:45:40.874188 52:54:00:12:35:02 > 08:00:27:84:b6:43, ethertype IPv4 (0x0800), length 60: 142.250.77.238.443 > 10.0.2.15.46806: Flags [.], ack 1367, win 65535, length 0
23:45:40.874272 52:54:00:12:35:02 > 08:00:27:84:b6:43, ethertype IPv4 (0x0800), length 60: 142.250.77.238.443 > 10.0.2.15.46808: Flags [.], ack 915, win 65535, length 0
23:45:40.888955 52:54:00:12:35:02 > 08:00:27:84:b6:43, ethertype IPv4 (0x0800), length 668: 142.250.77.238.443 > 10.0.2.15.46824: Flags [P.], seq 6584:7198, ack 915, win 65535, length 614
23:45:40.891422 08:00:27:84:b6:43 > 52:54:00:12:35:02, ethertype IPv4 (0x0800), length 78: 10.0.2.15.46824 > 142.250.77.238.443: Flags [P.], seq 915:939, ack 7198, win 62780, length 24
23:45:40.891479 08:00:27:84:b6:43 > 52:54:00:12:35:02, ethertype IPv4 (0x0800), length 54: 10.0.2.15.46824 > 142.250.77.238.443: Flags [F.], seq 939, ack 7198, win 62780, length 0
23:45:40.892276 52:54:00:12:35:02 > 08:00:27:84:b6:43, ethertype IPv4 (0x0800), length 60: 142.250.77.238.443 > 10.0.2.15.46824: Flags [.], ack 939, win 65535, length 0
23:45:40.892277 52:54:00:12:35:02 > 08:00:27:84:b6:43, ethertype IPv4 (0x0800), length 60: 142.250.77.238.443 > 10.0.2.15.46824: Flags [.], ack 940, win 65535, length 0
23:45:40.896573 52:54:00:12:35:02 > 08:00:27:84:b6:43, ethertype IPv4 (0x0800), length 85: 142.250.77.238.443 > 10.0.2.15.46824: Flags [P.], seq 7198:7229, ack 940, win 65535, length 31
23:45:40.896574 52:54:00:12:35:02 > 08:00:27:84:b6:43, ethertype IPv4 (0x0800), length 699: 142.250.77.238.443 > 10.0.2.15.46808: Flags [P.], seq 6583:7228, ack 915, win 65535, length 645
23:45:40.896601 08:00:27:84:b6:43 > 52:54:00:12:35:02, ethertype IPv4 (0x0800), length 54: 10.0.2.15.46824 > 142.250.77.238.443: Flags [R], seq 3242373302, win 0, length 0
23:45:40.897164 08:00:27:84:b6:43 > 52:54:00:12:35:02, ethertype IPv4 (0x0800), length 78: 10.0.2.15.46808 > 142.250.77.238.443: Flags [P.], seq 915:939, ack 7228, win 62780, length 24
23:45:40.897258 08:00:27:84:b6:43 > 52:54:00:12:35:02, ethertype IPv4 (0x0800), length 54: 10.0.2.15.46808 > 142.250.77.238.443: Flags [F.], seq 939, ack 7228, win 62780, length 0
23:45:40.897603 52:54:00:12:35:02 > 08:00:27:84:b6:43, ethertype IPv4 (0x0800), length 60: 142.250.77.238.443 > 10.0.2.15.46808: Flags [.], ack 939, win 65535, length 0
23:45:40.897603 52:54:00:12:35:02 > 08:00:27:84:b6:43, ethertype IPv4 (0x0800), length 60: 142.250.77.238.443 > 10.0.2.15.46808: Flags [.], ack 940, win 65535, length 0
23:45:40.907375 52:54:00:12:35:02 > 08:00:27:84:b6:43, ethertype IPv4 (0x0800), length 60: 142.250.77.238.443 > 10.0.2.15.46808: Flags [F.], seq 7228, ack 940, win 65535, length 0
23:45:40.907433 08:00:27:84:b6:43 > 52:54:00:12:35:02, ethertype IPv4 (0x0800), length 54: 10.0.2.15.46808 > 142.250.77.238.443: Flags [.], ack 7229, win 62780, length 0
23:45:41.069795 52:54:00:12:35:02 > 08:00:27:84:b6:43, ethertype IPv4 (0x0800), length 4520: 142.250.77.238.443 > 10.0.2.15.46806: Flags [P.], seq 7228:11694, ack 1367, win 65535, length 4466
23:45:41.069841 08:00:27:84:b6:43 > 52:54:00:12:35:02, ethertype IPv4 (0x0800), length 54: 10.0.2.15.46806 > 142.250.77.238.443: Flags [.], ack 11694, win 62780, length 0
23:45:41.097613 52:54:00:12:35:02 > 08:00:27:84:b6:43, ethertype IPv4 (0x0800), length 7114: 142.250.77.238.443 > 10.0.2.15.46806: Flags [P.], seq 11694:18754, ack 1367, win 65535, length 7060
23:45:41.097644 08:00:27:84:b6:43 > 52:54:00:12:35:02, ethertype IPv4 (0x0800), length 54: 10.0.2.15.46806 > 142.250.77.238.443: Flags [.], ack 18754, win 62780, length 0
23:45:41.100716 52:54:00:12:35:02 > 08:00:27:84:b6:43, ethertype IPv4 (0x0800), length 10274: 142.250.77.238.443 > 10.0.2.15.46806: Flags [.], seq 18754:28974, ack 1367, win 65535, length 10220
23:45:41.100768 08:00:27:84:b6:43 > 52:54:00:12:35:02, ethertype IPv4 (0x0800), length 54: 10.0.2.15.46806 > 142.250.77.238.443: Flags [.], ack 28974, win 62780, length 0
23:45:41.101087 52:54:00:12:35:02 > 08:00:27:84:b6:43, ethertype IPv4 (0x0800), length 4943: 142.250.77.238.443 > 10.0.2.15.46806: Flags [P.], seq 28974:33863, ack 1367, win 65535, length 4889
23:45:41.101100 08:00:27:84:b6:43 > 52:54:00:12:35:02, ethertype IPv4 (0x0800), length 54: 10.0.2.15.46806 > 142.250.77.238.443: Flags [.], ack 33863, win 62780, length 0
23:45:41.103356 52:54:00:12:35:02 > 08:00:27:84:b6:43, ethertype IPv4 (0x0800), length 9294: 142.250.77.238.443 > 10.0.2.15.46806: Flags [P.], seq 33863:43103, ack 1367, win 65535, length 9240
23:45:41.103386 08:00:27:84:b6:43 > 52:54:00:12:35:02, ethertype IPv4 (0x0800), length 54: 10.0.2.15.46806 > 142.250.77.238.443: Flags [.], ack 43103, win 62780, length 0
23:45:41.124789 08:00:27:84:b6:43 > 52:54:00:12:35:02, ethertype IPv4 (0x0800), length 202: 10.0.2.15.55890 > 34.120.208.123.443: Flags [P.], seq 3827:3975, ack 790, win 62780, length 148
23:45:41.124826 08:00:27:84:b6:43 > 52:54:00:12:35:02, ethertype IPv4 (0x0800), length 1400: 10.0.2.15.55890 > 34.120.208.123.443: Flags [P.], seq 3975:5321, ack 790, win 62780, length 1346
23:45:41.126038 52:54:00:12:35:02 > 08:00:27:84:b6:43, ethertype IPv4 (0x0800), length 60: 34.120.208.123.443 > 10.0.2.15.55890: Flags [.], ack 3975, win 65535, length 0
23:45:41.126038 52:54:00:12:35:02 > 08:00:27:84:b6:43, ethertype IPv4 (0x0800), length 60: 34.120.208.123.443 > 10.0.2.15.55890: Flags [.], ack 5321, win 65535, length 0
23:45:41.176280 52:54:00:12:35:02 > 08:00:27:84:b6:43, ethertype IPv4 (0x0800), length 1514: 142.250.77.238.443 > 10.0.2.15.46806: Flags [.], seq 43103:44563, ack 1367, win 65535, length 1460
23:45:41.176359 52:54:00:12:35:02 > 08:00:27:84:b6:43, ethertype IPv4 (0x0800), length 8026: 142.250.77.238.443 > 10.0.2.15.46806: Flags [P.], seq 44563:52535, ack 1367, win 65535, length 7972
23:45:41.176378 08:00:27:84:b6:43 > 52:54:00:12:35:02, ethertype IPv4 (0x0800), length 54: 10.0.2.15.46806 > 142.250.77.238.443: Flags [.], ack 52535, win 62780, length 0
23:45:41.177113 08:00:27:84:b6:43 > 52:54:00:12:35:02, ethertype IPv4 (0x0800), length 93: 10.0.2.15.46806 > 142.250.77.238.443: Flags [P.], seq 1367:1406, ack 52535, win 62780, length 39
23:45:41.178463 52:54:00:12:35:02 > 08:00:27:84:b6:43, ethertype IPv4 (0x0800), length 60: 142.250.77.238.443 > 10.0.2.15.46806: Flags [.], ack 1406, win 65535, length 0
23:45:41.207544 08:00:27:84:b6:43 > 52:54:00:12:35:02, ethertype IPv4 (0x0800), length 74: 10.0.2.15.38754 > 142.250.193.54.443: Flags [S], seq 2509939201, win 64240, options [mss 1460,sackOK,TS val 1508561959 ecr 0,nop,wscale 7], length 0
23:45:41.217016 08:00:27:84:b6:43 > 52:54:00:12:35:02, ethertype IPv4 (0x0800), length 74: 10.0.2.15.38002 > 142.250.77.234.443: Flags [S], seq 1355593701, win 64240, options [mss 1460,sackOK,TS val 83265541 ecr 0,nop,wscale 7], length 0
23:45:41.347678 52:54:00:12:35:02 > 08:00:27:84:b6:43, ethertype IPv4 (0x0800), length 60: 142.250.77.234.443 > 10.0.2.15.38002: Flags [S.], seq 58688001, ack 1355593702, win 65535, options [mss 1460], length 0
23:45:41.347679 52:54:00:12:35:02 > 08:00:27:84:b6:43, ethertype IPv4 (0x0800), length 60: 142.250.193.54.443 > 10.0.2.15.38754: Flags [S.], seq 58752001, ack 2509939202, win 65535, options [mss 1460], length 0
23:45:41.347716 08:00:27:84:b6:43 > 52:54:00:12:35:02, ethertype IPv4 (0x0800), length 54: 10.0.2.15.38002 > 142.250.77.234.443: Flags [.], ack 1, win 64240, length 0
23:45:41.347736 08:00:27:84:b6:43 > 52:54:00:12:35:02, ethertype IPv4 (0x0800), length 54: 10.0.2.15.38754 > 142.250.193.54.443: Flags [.], ack 1, win 64240, length 0
23:45:41.348797 08:00:27:84:b6:43 > 52:54:00:12:35:02, ethertype IPv4 (0x0800), length 713: 10.0.2.15.38754 > 142.250.193.54.443: Flags [P.], seq 1:660, ack 1, win 64240, length 659
23:45:41.350175 52:54:00:12:35:02 > 08:00:27:84:b6:43, ethertype IPv4 (0x0800), length 60: 142.250.193.54.443 > 10.0.2.15.38754: Flags [.], ack 660, win 65535, length 0
23:45:41.350367 08:00:27:84:b6:43 > 52:54:00:12:35:02, ethertype IPv4 (0x0800), length 722: 10.0.2.15.38002 > 142.250.77.234.443: Flags [P.], seq 1:669, ack 1, win 64240, length 668
23:45:41.351585 52:54:00:12:35:02 > 08:00:27:84:b6:43, ethertype IPv4 (0x0800), length 60: 142.250.77.234.443 > 10.0.2.15.38002: Flags [.], ack 669, win 65535, length 0
23:45:41.436408 52:54:00:12:35:02 > 08:00:27:84:b6:43, ethertype IPv4 (0x0800), length 2974: 142.250.193.54.443 > 10.0.2.15.38754: Flags [.], seq 1:2921, ack 660, win 65535, length 2920
23:45:41.436445 08:00:27:84:b6:43 > 52:54:00:12:35:02, ethertype IPv4 (0x0800), length 54: 10.0.2.15.38754 > 142.250.193.54.443: Flags [.], ack 2921, win 62780, length 0
23:45:41.437074 52:54:00:12:35:02 > 08:00:27:84:b6:43, ethertype IPv4 (0x0800), length 1695: 142.250.193.54.443 > 10.0.2.15.38754: Flags [P.], seq 2921:4562, ack 660, win 65535, length 1641
23:45:41.437097 08:00:27:84:b6:43 > 52:54:00:12:35:02, ethertype IPv4 (0x0800), length 54: 10.0.2.15.38754 > 142.250.193.54.443: Flags [.], ack 4562, win 62780, length 0
23:45:41.443114 08:00:27:84:b6:43 > 52:54:00:12:35:02, ethertype IPv4 (0x0800), length 474: 10.0.2.15.51158 > 142.250.194.195.80: Flags [P.], seq 421:841, ack 702, win 63539, length 420: HTTP: POST /wr2 HTTP/1.1
23:45:41.444403 52:54:00:12:35:02 > 08:00:27:84:b6:43, ethertype IPv4 (0x0800), length 60: 142.250.194.195.80 > 10.0.2.15.51158: Flags [.], ack 841, win 65535, length 0
23:45:41.475056 52:54:00:12:35:02 > 08:00:27:84:b6:43, ethertype IPv4 (0x0800), length 216: 34.120.208.123.443 > 10.0.2.15.55890: Flags [P.], seq 790:952, ack 5321, win 65535, length 162
23:45:41.476814 52:54:00:12:35:02 > 08:00:27:84:b6:43, ethertype IPv4 (0x0800), length 93: 34.120.208.123.443 > 10.0.2.15.55890: Flags [P.], seq 952:991, ack 5321, win 65535, length 39
23:45:41.476816 52:54:00:12:35:02 > 08:00:27:84:b6:43, ethertype IPv4 (0x0800), length 2974: 142.250.77.234.443 > 10.0.2.15.38002: Flags [.], seq 1:2921, ack 669, win 65535, length 2920
23:45:41.476902 08:00:27:84:b6:43 > 52:54:00:12:35:02, ethertype IPv4 (0x0800), length 54: 10.0.2.15.38002 > 142.250.77.234.443: Flags [.], ack 2921, win 62780, length 0
23:45:41.477141 08:00:27:84:b6:43 > 52:54:00:12:35:02, ethertype IPv4 (0x0800), length 54: 10.0.2.15.55890 > 34.120.208.123.443: Flags [.], ack 991, win 62780, length 0
23:45:41.477260 08:00:27:84:b6:43 > 52:54:00:12:35:02, ethertype IPv4 (0x0800), length 93: 10.0.2.15.55890 > 34.120.208.123.443: Flags [P.], seq 5321:5360, ack 991, win 62780, length 39
23:45:41.478062 52:54:00:12:35:02 > 08:00:27:84:b6:43, ethertype IPv4 (0x0800), length 1625: 142.250.77.234.443 > 10.0.2.15.38002: Flags [P.], seq 2921:4492, ack 669, win 65535, length 1571
23:45:41.478083 52:54:00:12:35:02 > 08:00:27:84:b6:43, ethertype IPv4 (0x0800), length 60: 34.120.208.123.443 > 10.0.2.15.55890: Flags [.], ack 5360, win 65535, length 0
23:45:41.478100 08:00:27:84:b6:43 > 52:54:00:12:35:02, ethertype IPv4 (0x0800), length 54: 10.0.2.15.38002 > 142.250.77.234.443: Flags [.], ack 4492, win 62780, length 0
23:45:41.496509 08:00:27:84:b6:43 > 52:54:00:12:35:02, ethertype IPv4 (0x0800), length 74: 10.0.2.15.51164 > 142.250.194.195.80: Flags [S], seq 3697577790, win 64240, options [mss 1460,sackOK,TS val 2511214349 ecr 0,nop,wscale 7], length 0
